productTitle,productPrice,subCategoryName
Coles Full Cream Milk | 2L,3.1,Full Cream Milk
Hunt & Brew Extra Creamy Milk | 1L,3.95,Full Cream Milk
Hunt & Brew Creamy Milk | 1L,3.95,Full Cream Milk
Pura Full Cream Milk | 2L,4.3,Full Cream Milk
Great Ocean Road Fresh Full Cream Milk | 2L,4.7,Full Cream Milk
Coles Dairy Full Cream Milk | 1L,1.6,Full Cream Milk
Green Pastures Full Cream Milk | 2L,4.3,Full Cream Milk
Great Ocean Road Fresh Full Cream Milk | 1L,2.9,Full Cream Milk
Devondale Full Cream Milk | 3L,5.95,Full Cream Milk
Coles Full Cream Milk | 600mL,1.3,Full Cream Milk
Pura Full Cream Milk | 1L,2.8,Full Cream Milk
Great Ocean Road Full Cream Milk | 3L,6.3,Full Cream Milk
Pura Milk Full Cream | 3L,5.95,Full Cream Milk
Pauls Farmhouse Gold Full Cream Milk | 1.5L,4.4,Full Cream Milk
Pauls Farmhouse Gold Cream On Top Milk | 1.5L,4.4,Full Cream Milk
The Complete Dairy High Protein Full Cream Milk | 1L,3.6,Full Cream Milk
Farmhouse Gold Full Cream Milk  | 750mL,2.9,Full Cream Milk
Devondale Full Cream Milk | 2L,4.2,Full Cream Milk
Coles Full Cream Milk | 3L,4.5,Full Cream Milk
Primo Hot Hungarian Salami | 80g,3.95,Full Cream Milk
Primo Roast Beef Thinly Sliced | 80g,3.95,Full Cream Milk
Don Dairy Strasburg Knob | 500g,7.45,Full Cream Milk
Thomson's Deli Sliced Chicken Quad Pack | 320g,6.5,Full Cream Milk
Primo Roast Pork Thinly Sliced | 80g,3.95,Full Cream Milk
Provedore Free Range Chorizo | 200g,7.5,Full Cream Milk
Primo Prosciutto | 100g,8,Full Cream Milk
Primo Silverside | 80g,3.95,Full Cream Milk
Provedore Salami Tasting Plate | 100g,7,Full Cream Milk
Coles Mild Salami | 200g,7.4,Full Cream Milk
Coles Spicy Chorizo Salami Knob | 200g,7.4,Full Cream Milk
Primo English Sliced Ham | 100g,3.95,Full Cream Milk
Don Double Smoked Leg Ham | 200g,5,Full Cream Milk
Primo Chicken Breast Thinly Sliced | 80g,3.95,Full Cream Milk
Don Crafted Cuts Sopressa Salami Slices | 80g,4.9,Full Cream Milk
Don Mild Hungarian Salami | 160g,5,Full Cream Milk
Don Crafted Cuts Hardwood Double Smoked Leg Ham | 100g,4.9,Full Cream Milk
Gotzinger Smallgoods Cheese Kransky Chipolata | 400g,10.5,Full Cream Milk
Primo Original Twiggy Sticks | 200g,7.8,Full Cream Milk
Primo Gluten Free Thinly Sliced Double Smoked Leg Ham | 100g,3.95,Full Cream Milk
Provedore Prosciutto | 100g,7,Full Cream Milk
Don Italian Style Shaved Salami | 160g,5,Full Cream Milk
Primo Sliced Turkey Breast | 80g,3.95,Full Cream Milk
Don English Style Sliced Ham | 200g,5,Full Cream Milk
Primo Cafe Classics Sliced Chicken Schnitzel | 150g,6.3,Full Cream Milk
Thomson's Deli Honey Ham Sliced Quad Pack | 400g,6,Full Cream Milk
Primo Gluten Free Thinly Sliced Pastrami Beef | 80g,3.95,Full Cream Milk
Don Leg Shaved Ham | 200g,5,Full Cream Milk
Don Honey Leg Ham | 200g,5,Full Cream Milk
Thomson's Deli Shredded Chicken Value Pack | 500g,7,Full Cream Milk
Primo Shredded Ham Twin Pack | 300g,5,Full Cream Milk
Primo Classic Chorizo 2 Pack | 250g,7.8,Full Cream Milk
Don Traditional Kabana | 200g,4.8,Full Cream Milk
Primo 25% Salt Reduced Leg Ham | 100g,3.95,Full Cream Milk
Thomson'S Deli English Style Ham Quad Pack | 400g,6,Full Cream Milk
Primo Mild Hungarian Salami | 80g,3.95,Full Cream Milk
Primo Manuka Honey Leg Ham | 100g,3.95,Full Cream Milk
Tibaldi Ham Off The Bone | 120g,5,Full Cream Milk
Primo Danish Salami | 80g,3.95,Full Cream Milk
Primo Pepperoni Hot Salami | 80g,3.95,Full Cream Milk
Provedore Mild Chorizo Salami | 100g,6,Full Cream Milk
Coles English Sliced Ham | 100g,2.45,Full Cream Milk
Coles Honey Sliced Ham Sow Stall Free | 100g,2.45,Full Cream Milk
Coles Shredded Roast Chicken Breast | 150g,5,Full Cream Milk
Primo Gluten Free Cheese Kransky | 250g,5.8,Full Cream Milk
Primo Champagne Leg Ham | 100g,3.95,Full Cream Milk
Thomson's Deli Mild Hungarian Salami | 320g,9,Full Cream Milk
Primo Gluten Free Classic Kransky | 250g,5.8,Full Cream Milk
