productTitle,productPrice,subCategoryName
Leggo's Agnolotti With Spinach Ricotta & Parmesan 360g,8,Fresh Pasta & Noodles
25 Degree South Baby Spinach & Fetta Ravioli Pasta 325g,9,Fresh Pasta & Noodles
Latina Fresh Lasagne Sheets Sheets 375g,6,Fresh Pasta & Noodles
Rana Pumpkin & Onion Ravioli Pasta 325g,8,Fresh Pasta & Noodles
Latina Fresh Ready Meal Angus Beef & Veg Lasagne Chilled Meal 1.6kg,17.5,Fresh Pasta & Noodles
Latina Fresh Beef Ravioli Pasta 375g,5.5,Fresh Pasta & Noodles
Evergreen Japanese Ramen Noodles 350g,2.55,Fresh Pasta & Noodles
Woolworths Angus Beef & Pork Meatball Rigatoni Chilled Meal 1.3kg,20,Fresh Pasta & Noodles
Grand Italian Gitf 4 Cheese Tortellini Tortellini 325g,5,Fresh Pasta & Noodles
Leggo's Ravioli Beef Tomato & Parmesan 360g,8,Fresh Pasta & Noodles
I Pastai Fresh Pappardelle 350g,6,Fresh Pasta & Noodles
Latina Fresh Gluten Free Beef Ravioli Pasta 280g,8.75,Fresh Pasta & Noodles
La Tosca Chilled Potato Gnocchi 500g,4.6,Fresh Pasta & Noodles
Leggo's Fresh Beef Tomato & Parmesan Ravioli 630g,9,Fresh Pasta & Noodles
Leggo's Fresh Ricotta & Vegetable Tortellini 630g,9,Fresh Pasta & Noodles
25 Degree South Native Pumpkin Ricotta Ravioli Pasta 325g,9,Fresh Pasta & Noodles
Latina Fresh Roast Chicken & Garlic Ravioli Pasta 625g,11,Fresh Pasta & Noodles
Rana Ricotta & Spinach Tortellini Pasta 325g,8,Fresh Pasta & Noodles
Grand Italian Pan Fry Gnocchi Three Cheese 400g,7,Fresh Pasta & Noodles
Evergreen Chow Mein Noodles 280g,2.55,Fresh Pasta & Noodles
Fantastic Fresh Noodles Hokkien 450g,3,Fresh Pasta & Noodles
Rana Egg Lasagne Pasta 250g,5.5,Fresh Pasta & Noodles
Grand Italian Tuscans Finest Veal Ravioli 325g,5,Fresh Pasta & Noodles
Ready Chef Creamy Tomato & Bacon Pasta Bake 1.1kg,11.45,Fresh Pasta & Noodles
Rana Basil & Pine Nuts Tortellini Pasta 325g,8,Fresh Pasta & Noodles
Rana Porcini Mushroom Ravioli Pasta 325g,8,Fresh Pasta & Noodles
Rana Burrata Cheese & Arrabbiata Ravioli 300g,8.5,Fresh Pasta & Noodles
Rana Pecorino Romano & Black Pepper Tortellini 300g,8.5,Fresh Pasta & Noodles
Johnny Wong Stir Fry Rice Noodles 400g,5,Fresh Pasta & Noodles
Leggo's Fresh Ricotta & Spinach Agnolotti 630g,9,Fresh Pasta & Noodles
Johnny Wong Hokkien Noodles 500g,5,Fresh Pasta & Noodles
Woolworths Slow Cooked Beef Ragu Lasagne 1.3kg,20,Fresh Pasta & Noodles
Latina Fresh Gluten Free Lasagne Sheets 280g,8.75,Fresh Pasta & Noodles
Guzzi's Golden Pasta Gnocchi Potato 500g,6,Fresh Pasta & Noodles
Latina Fresh Kids Mini Ravioli Pasta Cheese & Vegetable 200g,5.1,Fresh Pasta & Noodles
Pasta Master Beef Lasagne 1.3kg,17,Fresh Pasta & Noodles
Grand Italian Tuscan Finest Panfry Gnocchi Sundried Tomato & Cheese 400g,7,Fresh Pasta & Noodles
Latina Fresh Egg Fettuccine Pasta 375g,6,Fresh Pasta & Noodles
Pasta Master Chicken & Bacon Bake Chilled Meal 1.2kg,17,Fresh Pasta & Noodles
Pasta Master Macaroni Meaty Mac & Cheese Chilled Meal 1.2kg,17,Fresh Pasta & Noodles
Grand Italian Tuscans Finest Creamy Ricotta Spinach Agnolotti 325g,5,Fresh Pasta & Noodles
Rana Fettuccine Pasta 325g,6,Fresh Pasta & Noodles
Latina Fresh Spinach & Ricotta Agnolotti 375g,5.5,Fresh Pasta & Noodles
Rana Creamy Pumpkin & Cheese Tortellini 565g,10,Fresh Pasta & Noodles
Latina Fresh Ricotta & Spinach Agnolotti Pasta 625g,11,Fresh Pasta & Noodles
Leggo's Fresh Roasted Pumpkin  & Feta Ravioli 630g,9,Fresh Pasta & Noodles
Ready Chef Cheesy Pasta Bake 1.1kg,11.45,Fresh Pasta & Noodles
Woolworths Spaghetti Bolognese Bolognese Chilled Meal 1.1kg,14,Fresh Pasta & Noodles
Grand Italian Ravioli Protein Pasta Beef 325g,5,Fresh Pasta & Noodles
Grand Italian Tuscan Finest Vodka Tomato Fresh Pasta Sauce 250g,4.5,Fresh Pasta & Noodles
25 Degree South Victorian Three Cheese Ravioli Pasta 325g,9,Fresh Pasta & Noodles
Latina Fresh Beef Ravioli Pasta Ravioli 625g,11,Fresh Pasta & Noodles
Grand Italian Fresh Potato Gnocchi 500g,5.5,Fresh Pasta & Noodles
Latina Fresh Veal Tortellini Pasta 625g,11,Fresh Pasta & Noodles
Rana Ricotta & Spinach Tortellini 565g,10,Fresh Pasta & Noodles
I Pastai Fresh Linguine 350g,6,Fresh Pasta & Noodles
Rana Gorgonzola Cheese Pdo & Walnut Ravioli 300g,8.5,Fresh Pasta & Noodles
Woolworths Beef Lasagne 2kg,13.3,Fresh Pasta & Noodles
Leggo's Fresh Veal Tortellini 630g,9,Fresh Pasta & Noodles
Latina Fresh Kids Mini Ravioli Pasta Beef & Vegetable 200g,5.1,Fresh Pasta & Noodles
I Pastai Gnocchi Di Patate 500g,6,Fresh Pasta & Noodles
Ready Chef Penne Bolognaise Family Size Bake 1.1kg,11.45,Fresh Pasta & Noodles
Johnny Wong Singapore Noodles 500g,5,Fresh Pasta & Noodles
La Tosca Chilled Beef Ravioli 750g,6,Fresh Pasta & Noodles
Grand Italian Gnocchi Pesto & Parmesan Premium 400g,7,Fresh Pasta & Noodles
Latina Fresh Gluten Free Ricotta & Spinach Ravioli Pasta 280g,8.75,Fresh Pasta & Noodles
Woolworths Ricotta & Spinach Cannelloni Chilled Meal 700g,12.7,Fresh Pasta & Noodles
Guzzi's Golden Pasta Gnocchi Potato Dry 500g,4.8,Fresh Pasta & Noodles
