productTitle,productPrice,subCategoryName
Picasso Kitchen Pizza Dough Ball 250g,2,Chilled Pizza & Bread
Sugo Tu Pizza Sauce Chilled 150g,2.5,Chilled Pizza & Bread
La Famiglia Garlic Bread 400g,5,Chilled Pizza & Bread
Picasso Kitchen Hawaiian Pizza 600g,9,Chilled Pizza & Bread
Nevana Pizza Base 12 Pack,4.8,Chilled Pizza & Bread
Supreme Foods Roti Bread Canai 4 Pack 500g,8,Chilled Pizza & Bread
Picasso Kitchen Homemade Pinsa Romana Pepperoni & Cheese Pizza 400g,7.5,Chilled Pizza & Bread
Picasso Kitchen Bbq Meat Lovers Pizza 600g,9,Chilled Pizza & Bread
La Famiglia Garlic Bread Slices 270g,6.5,Chilled Pizza & Bread
Antoniou Fillo Pastry 375g,4.5,Chilled Pizza & Bread
Senza Gluten Free Pizza Base 220g,5,Chilled Pizza & Bread
Picasso Kitchen Stone Baked Pizza Double Pepperoni 420g,6,Chilled Pizza & Bread
Picasso Kitchen Super Supreme Pizza 470g,6,Chilled Pizza & Bread
La Famiglia Cheesy Garlic Bread 460g,8,Chilled Pizza & Bread
Global Bakehouse Garlic Bread 450g,2.3,Chilled Pizza & Bread
Creative Foods Chilled Garlic Bread 2 Pack 500g,4.8,Chilled Pizza & Bread
La Famiglia Garlic Bread Sourdough 480g,5,Chilled Pizza & Bread
Picasso Kitchen Kitchen Pizza Base 260g,2.2,Chilled Pizza & Bread
La Famiglia Just For 2 Cheesy Garlic Bread 190g,4.5,Chilled Pizza & Bread
Creative Foods Cheese & Garlic Bread 250g,3,Chilled Pizza & Bread
Picasso Kitchen Homemade Pizza Pinsa Romana Napoli Sauce & Cheese 320g,5.5,Chilled Pizza & Bread
La Famiglia Garlic Bread Just For 2 170g,3.5,Chilled Pizza & Bread
Picasso Kitchen Homemade Pizza Pinsa Romana Garlic Herb & Cheese 320g,5.5,Chilled Pizza & Bread
Picasso Kitchen Supreme Pizza 600g,9,Chilled Pizza & Bread
Picasso Kitchen Stone Baked Pizza Bbq Meat Deluxe 470g,6,Chilled Pizza & Bread
Woolworths Garlic Bread Slices 270g,3,Chilled Pizza & Bread
Woolworths Garlic Loaf 400g,3.25,Chilled Pizza & Bread
Free From Gluten & Dairy Garlic Bread 250g,4.5,Chilled Pizza & Bread
Jase's Kitchen Pizza Base 2 Pack,4.5,Chilled Pizza & Bread
Creative Foods Garlic Sourdough Bread 225g,3.4,Chilled Pizza & Bread
Della Rosa Low Carb High Protein Pizza Base 250g,3.5,Chilled Pizza & Bread
Picasso Kitchen Kitchen Cauliflower Base 170g,4.2,Chilled Pizza & Bread
Picasso Kitchen Bbq Chicken & Bacon Pizza 460g,6,Chilled Pizza & Bread
La Famiglia Garlic Bread Entertainer Slices 450g,8,Chilled Pizza & Bread
La Famiglia Garlic Bread 250g,3,Chilled Pizza & Bread
Sugo Tu Pizza Dough Chilled 200g,3,Chilled Pizza & Bread
Della Rosa Tomato Sauce Pizza Base 280g,3,Chilled Pizza & Bread
Della Rosa Stone Baked Herb & Garlic Pizza Base 2 Pack,5.5,Chilled Pizza & Bread
