productTitle,productPrice,subCategoryName
Caldermeade Farm Goats Cheese 4 Peppercorn Mix | 270g,11.5,Gourmet Cheese
Ashgrove Tasmanian Smoked Cheddar The Hazards | 140g,6.5,Gourmet Cheese
Coles Gorgonzola Dolce | 200g,5.7,Gourmet Cheese
Aphrodite Barrel Aged Feta Portion | 170g,12.2,Gourmet Cheese
Ashgrove Signature Red Leicester | 150g,8,Gourmet Cheese
Snowdonia Black Bomber | 150g,9.5,Gourmet Cheese
Ashgrove Natural Wood Cold Smoked Havarti Cheese Block | 140g,6.5,Gourmet Cheese
Coles Spanish Iberico | 150g,6,Gourmet Cheese
Tidbit Spanish Goats Cheese | 150g,7,Gourmet Cheese
Moondarra Cheese Herb & Capsicum | 120g,3.9,Gourmet Cheese
Aphrodite Kefalotyri | 170g,13,Gourmet Cheese
Coles Dutch Maasdam | 260g,6,Gourmet Cheese
Coles Finest Spanish Red Wine Cheese | 150g,6.6,Gourmet Cheese
Tidbit Gorgonzola Dolce Dop | 200g,7,Gourmet Cheese
Snowdonia Red Storm | 150g,9.5,Gourmet Cheese
Ashgrove Signature Smoked Red Leicester | 150g,8,Gourmet Cheese
Kebia Bulgarian Sheep's Cheese | 400g,10,Gourmet Cheese
Kroon Goats Cheese Wedge | 200g,8,Gourmet Cheese
Coles Danish Blue Cheese | 100g,4.4,Gourmet Cheese
South Cape Spring Onion & Chive Cream Cheese | 200g,6.5,Gourmet Cheese
Ashgrove Signature Vintage Eddington Cheddar | 150g,8,Gourmet Cheese
Coles Finest Pate | 150g,4.8,Gourmet Cheese
Jarlsberg Cheese Wedge | 230g,10.5,Gourmet Cheese
Castello Double Cream Brie Chilli | 150g,7.5,Gourmet Cheese
Black Jack Aged Cheddar Spaccato | approx 250g,5,Gourmet Cheese
South Cape Dairy Fetta Crumbed Cheese | 200g,8,Gourmet Cheese
Ashgrove Tasmanian Vintage Cheddar Wineglass Bay | 140g,6.5,Gourmet Cheese
Coles Finest Spanish Truffle Cheese | 140g,7.85,Gourmet Cheese
Castello Intense Blue | 150g,7.5,Gourmet Cheese
Tasmanian Heritage Cheese Marinated Fetta | 350g,11.5,Gourmet Cheese
Yarra Valley Cheese Salted Honey Cow | 80g,3.5,Gourmet Cheese
Cremeux Truffle Brie | 180g,8,Gourmet Cheese
South Cape Brie | 200g,7.5,Gourmet Cheese
Yarra Valley Cheese Fresh Goats Cheese | 80g,5.5,Gourmet Cheese
Mersey Valley Salt & Vinegar Cheddar | 80g,4.8,Gourmet Cheese
Castello Danish Blue Extra Creamy | 100g,5.8,Gourmet Cheese
Lemnos Roasted Garlic And Rosemary Haloumi | 180g,7,Gourmet Cheese
Caldermeade Farm Goats Cheese Block | 180g,7,Gourmet Cheese
Riverina Haloumi Basil | 180g,6.6,Gourmet Cheese
Unicorn Classic Brie Chilli | 125g,6,Gourmet Cheese
Mersey Valley Club Ploughman's Cheddar Cheese  | 235g,7,Gourmet Cheese
Unicorn Selections Truffle Brie | 125g,6.5,Gourmet Cheese
Castello Creamy Havarti | 200g,8,Gourmet Cheese
Emborg French Double Cream Le Fromager | 300g,8.95,Gourmet Cheese
Yarra Valley Cheese Persian Fetta Dill & Chive | 350g,11.4,Gourmet Cheese
Tasmanian Heritage Club Cheddar Vintage | 140g,6.5,Gourmet Cheese
Coles British Blue Stilton | 150g,5.5,Gourmet Cheese
Lemnos Haloumi Slices | 200g,8,Gourmet Cheese
Mersey Valley Club Pickled Onion Cheddar Cheese | 235g,7,Gourmet Cheese
Jarlsberg Original Cheese Block | 500g,18,Gourmet Cheese
Tasmanian Heritage Club Cheddar Smoked | 140g,6.5,Gourmet Cheese
Unicorn Selections Ash Brie | 125g,6.5,Gourmet Cheese
South Cape Reduced Fat Greek Style Fetta | 200g,6.5,Gourmet Cheese
Dodoni Saganaki | 200g,12,Gourmet Cheese
King Island Dairy Surprise Bay Cheddar Cheese Block | approx200g,10.8,Gourmet Cheese
Tasmanian Heritage Trilogy Summer Herbs Vintage Cheddar & Sundried Tomato | 140g,6.5,Gourmet Cheese
Castello Aged Havarti | 200g,6.5,Gourmet Cheese
Ashgrove Three Peaks Tassie Trio Cheese | 140g,6.5,Gourmet Cheese
Mersey Valley Salt & Vinegar Cheddar | 235g,7,Gourmet Cheese
Mersey Valley Club Green Peppercorn Cheese | 235g,7,Gourmet Cheese
Cremeux Blue | 100g,8,Gourmet Cheese
Mifroma Le Gruyere Aop | 150g,10,Gourmet Cheese
Riverina Fetta Basil Pesto | 200g,5.3,Gourmet Cheese
King Island Dairy Stokes Point Smoked Cheddar Cheese | 170g,10.95,Gourmet Cheese
South Cape Camembert | 200g,7.5,Gourmet Cheese
Moondarra Marinated Cheese | 430g,12,Gourmet Cheese
Tasmanian Heritage Little Entertainers Trilogy Summer Herbs Vintage Cheddar & Sundired Tomato | 80g,4.8,Gourmet Cheese
Coles Dutch Edam | 230g,6,Gourmet Cheese
Emborg French Camembert Petit | 125g,5.2,Gourmet Cheese
Lemnos Haloumi | 600g,14.4,Gourmet Cheese
