productTitle,productPrice,subCategoryName
South Cape Cream Cheese Sweet Chilli | 80g,4.8,Specialty & Entertaining Cheese
Coles Cheese Apricot & Almond | 190g,3.8,Specialty & Entertaining Cheese
South Cape Cream Cheese Apricot Almond | 80g,4.8,Specialty & Entertaining Cheese
Caldermeade Farm Goats Cheese 4 Peppercorn Mix | 270g,11.5,Specialty & Entertaining Cheese
Meredith Goats Cheese Chevre | 80g,5.5,Specialty & Entertaining Cheese
Coles Cheese Spring Onion & Chive | 190g,3.8,Specialty & Entertaining Cheese
Moondarra Honey & Pistachio Cream Cheese | 120g,3.9,Specialty & Entertaining Cheese
Meredith Dairy Goats Cheese Chevre Dill | 80g,5.5,Specialty & Entertaining Cheese
Meredith Dairy Marinated Goats Cheese | 100g,4.5,Specialty & Entertaining Cheese
Coles Finest Wensleydale With Cranberry PGI | 150g,6.5,Specialty & Entertaining Cheese
Moondarra Marinated Cheese | 430g,12,Specialty & Entertaining Cheese
Moondarra Cheese Honey Fig & Macadamia | 120g,3.9,Specialty & Entertaining Cheese
Meredith Dairy Marinated Goats Cheese | 550g,21,Specialty & Entertaining Cheese
Kroon Goats Cheese Wedge | 200g,8,Specialty & Entertaining Cheese
Caldermeade Farm Goats Cheese Block | 180g,7,Specialty & Entertaining Cheese
Moondarra Cheese Herb & Capsicum | 120g,3.9,Specialty & Entertaining Cheese
South Cape Apricot & Almond Cream Cheese | 200g,6.5,Specialty & Entertaining Cheese
South Cape Spring Onion & Chive Cream Cheese | 200g,6.5,Specialty & Entertaining Cheese
Coles French Goat's Cheese | 110g,4.5,Specialty & Entertaining Cheese
Coles Sweet Chilli Cheese | 190g,3.8,Specialty & Entertaining Cheese
Yarra Valley Cheese Fresh Goats Cheese | 80g,5.5,Specialty & Entertaining Cheese
Australian Gold Dairy Cheese Camembert | 115g,4.5,Specialty & Entertaining Cheese
Montefiore Mascarpone | 250g,6.5,Specialty & Entertaining Cheese
Moondarra Honey & Pistachio Cream Cheese | 120g,3.9,Specialty & Entertaining Cheese
Coles Finest Wensleydale With Cranberry PGI | 150g,6.5,Specialty & Entertaining Cheese
Somerdale IL Truffelino Cheddar Cheese With Truffle | 150g,8.8,Specialty & Entertaining Cheese
Jindi Brie | 125g,5.5,Specialty & Entertaining Cheese
Australian Gold Dairy Cheese Brie | 115g,4.5,Specialty & Entertaining Cheese
Coles Smooth Blue Cheese | 150g,5.5,Specialty & Entertaining Cheese
Tasmanian Heritage Trilogy Roasted Onion & Chive Vintage & Smoked Cheddar | 140g,6.5,Specialty & Entertaining Cheese
Delre Dutch Smoked Cheese | approx 250g,9,Specialty & Entertaining Cheese
Meredith Dairy Goats Cheese Chevre Dill | 80g,5.5,Specialty & Entertaining Cheese
Lemnos Foods Dairy Cheese Paneer | 200g,8,Specialty & Entertaining Cheese
Jindi Camembert | 125g,5.5,Specialty & Entertaining Cheese
Mersey Valley Little Entertainer Pickled Onion | 80g,4.8,Specialty & Entertaining Cheese
Unicorn Classic Camembert | 125g,6,Specialty & Entertaining Cheese
Castello Blue Cheese Mini 5 Pack | 95g,6.2,Specialty & Entertaining Cheese
Unicorn Classic Double Brie | 125g,6,Specialty & Entertaining Cheese
Mersey Valley Jalapeno Vintage Cheddar | 80g,4.8,Specialty & Entertaining Cheese
Yarra Valley Cheese Marinated Persian Fetta | 350g,11.4,Specialty & Entertaining Cheese
Moondarra Cheese Honey Fig & Macadamia | 120g,3.9,Specialty & Entertaining Cheese
Mersey Valley Club Vintage Dairy Extra Tasty Cheddar Cheese | 180g,8.65,Specialty & Entertaining Cheese
Castello Danish Blue Cheese | 100g,4.8,Specialty & Entertaining Cheese
Kroon Smoked Cheese Wedge | 150g,5,Specialty & Entertaining Cheese
King Island Dairy Phoques Cove Camembert Cheese | 200g,14.95,Specialty & Entertaining Cheese
Kenilworth Sweet Chilli Sour Cream & Bell Peppers Club Cheddar Cheese | 165g,5.5,Specialty & Entertaining Cheese
Mersey Valley Club Dairy Original Vintage Cheddar Cheese | 180g,8.65,Specialty & Entertaining Cheese
Unicorn Classic Triple Cream Brie | 125g,6,Specialty & Entertaining Cheese
Emborg French Brie Portions | 240g,8.5,Specialty & Entertaining Cheese
Lemnos Twin Packs Haloumi | 200g,9,Specialty & Entertaining Cheese
Coles Dutch Gouda | 265g,6,Specialty & Entertaining Cheese
Tasmanian Heritage Cheese Wedge Edam | 180g,6.5,Specialty & Entertaining Cheese
Castello Herbs & Garlic In Oil Marinated Fetta | 265g,7,Specialty & Entertaining Cheese
Riverina Haloumi | 900g,21,Specialty & Entertaining Cheese
South Cape Apricot & Almond Cream Cheese | 200g,6.5,Specialty & Entertaining Cheese
Riverina Fetta Greek Style | 200g,5.3,Specialty & Entertaining Cheese
Coles Spanish Manchego | 150g,5.5,Specialty & Entertaining Cheese
Tasmanian Heritage Little Entertainers Havarti | 80g,4.8,Specialty & Entertaining Cheese
Jindi Dairy Cheese Camembert | 200g,7,Specialty & Entertaining Cheese
Emborg French Brie Petit | 125g,5.2,Specialty & Entertaining Cheese
Coles French Goat's Cheese | 110g,4.5,Specialty & Entertaining Cheese
Kenilworth Roast Garlic & Cracked Pepper Cheddar | 165g,5.5,Specialty & Entertaining Cheese
Castello Double Cream Truffle Cheese | 150g,8,Specialty & Entertaining Cheese
Jarlsberg Original Cheese Block | 250g,10.5,Specialty & Entertaining Cheese
Coles Ash Brie | 200g,5.5,Specialty & Entertaining Cheese
KCF Lime & Cracked Pepper Club Cheddar | 165g,5.5,Specialty & Entertaining Cheese
Castello Creamy Blue Cheese | 300g,14.5,Specialty & Entertaining Cheese
Lemnos Dairy Organic Haloumi Cheese | 180g,7,Specialty & Entertaining Cheese
Emborg French Brie | 200g,7.2,Specialty & Entertaining Cheese
Castello Blue Cheese | 150g,7.5,Specialty & Entertaining Cheese
Coles Cherry Bocconcini | 220g,4.8,Specialty & Entertaining Cheese
La Casa Del Formaggio Fresh Mozzarella | 200g,6,Specialty & Entertaining Cheese
Riverina Fetta Greek Style | 200g,5.3,Specialty & Entertaining Cheese
Riverina Haloumi | 900g,21,Specialty & Entertaining Cheese
Coles Dairy Cheese Brie Wrapped | 125g,2.8,Specialty & Entertaining Cheese
La Casa Del Formaggio Bocconcini Bambini Cheese | 220g,6,Specialty & Entertaining Cheese
Lemnos Foods Dairy Cyprus Style Cheese Haloumi | 180g,7,Specialty & Entertaining Cheese
Tasmanian Heritage Triple Cream Brie Oval | 125g,7.5,Specialty & Entertaining Cheese
Tasmanian Heritage Little Entertainers Double Brie | 80g,4.8,Specialty & Entertaining Cheese
La Casa Del Formaggio Original Bocconcini Cheese | 220g,6,Specialty & Entertaining Cheese
Coles Marinated Danish Fetta | 300g,6.1,Specialty & Entertaining Cheese
Castello Herbs & Garlic In Oil Marinated Fetta | 265g,7,Specialty & Entertaining Cheese
Meredith Dairy Marinated Goats Cheese | 550g,21,Specialty & Entertaining Cheese
South Cape Cream Cheese Sweet Chilli | 80g,4.8,Specialty & Entertaining Cheese
Coles Cheese Spring Onion & Chive | 190g,3.8,Specialty & Entertaining Cheese
Coles Double Cream Camembert | 200g,6.5,Specialty & Entertaining Cheese
Coles Dairy Cheese Fetta Aust Style | 200g,3.5,Specialty & Entertaining Cheese
Mersey Valley Little Entertainer Classic | 80g,4.8,Specialty & Entertaining Cheese
Mersey Valley Club Classic Cheddar Cheese | 235g,7,Specialty & Entertaining Cheese
Riverina Haloumi Basil | 180g,6.6,Specialty & Entertaining Cheese
La Casa Del Formaggio Burrata | 150g,6.5,Specialty & Entertaining Cheese
Lemnos Fetta Traditional | 180g,6.5,Specialty & Entertaining Cheese
Dodoni Halloumi | 225g,7,Specialty & Entertaining Cheese
Riverina Fetta Basil Pesto | 200g,5.3,Specialty & Entertaining Cheese
Meredith Dairy Marinated Goats Cheese | 100g,4.5,Specialty & Entertaining Cheese
South Cape Cream Cheese Apricot Almond | 80g,4.8,Specialty & Entertaining Cheese
Mersey Valley Club Original Cheddar Cheese | 235g,7,Specialty & Entertaining Cheese
Tasmanian Heritage Camembert Oval | 125g,7.5,Specialty & Entertaining Cheese
Coles Sweet Chilli Cheese | 190g,3.8,Specialty & Entertaining Cheese
Castello Double Cream Truffle Cheese | 150g,8,Specialty & Entertaining Cheese
Jindi Triple Cream Brie | 180g,7,Specialty & Entertaining Cheese
Coles Triple Cream Brie | 200g,6.5,Specialty & Entertaining Cheese
Emborg French Camembert | 200g,7.2,Specialty & Entertaining Cheese
Tasmanian Heritage Double Cream Brie | 200g,5.9,Specialty & Entertaining Cheese
Tasmanian Heritage Cheese Wedge Gouda | 180g,6.5,Specialty & Entertaining Cheese
Coles Traditional Bocconcini | 210g,4.8,Specialty & Entertaining Cheese
La Casa Del Formaggio Cherry Bocconcini Cheese | 220g,6,Specialty & Entertaining Cheese
Meredith Goats Cheese Chevre | 80g,5.5,Specialty & Entertaining Cheese
King Island Dairy Cape Wickham Double Brie | 200g,14.95,Specialty & Entertaining Cheese
Lemnos Reduced Salt Haloumi | 180g,7,Specialty & Entertaining Cheese
Coles Dairy Cheese Camembert Wrapped | 125g,2.8,Specialty & Entertaining Cheese
Coles Cheese Apricot & Almond | 190g,3.8,Specialty & Entertaining Cheese
Lemnos Traditional Fetta Twin Pack | 200g,7,Specialty & Entertaining Cheese
Coles Cypriot Halloumi With Mint | 250g,6.5,Specialty & Entertaining Cheese
South Cape Greek Style Fetta | 200g,6.5,Specialty & Entertaining Cheese
Tasmanian Heritage Cheese Wedge Havarti | 180g,6.5,Specialty & Entertaining Cheese
Coles Finest Aged Red Leicester | 200g,5,Specialty & Entertaining Cheese
Castello Double Cream Brie | 150g,7.5,Specialty & Entertaining Cheese
Castello Fetta Cubes In Brine | 430g,6,Specialty & Entertaining Cheese
Tasmanian Heritage Camembert | 200g,5.9,Specialty & Entertaining Cheese
Coles Finest Vintage British Cheddar | 200g,5,Specialty & Entertaining Cheese
Riverina Haloumi | 180g,6.6,Specialty & Entertaining Cheese
Tasmanian Heritage Little Entertainers Camembert | 80g,4.8,Specialty & Entertaining Cheese
